{
  "schema": "chuckchuck.tour-index",
  "version": 1,
  "default": "delivery-rating",
  "tours": [
    {
      "id": "delivery-rating",
      "label": "C-1",
      "title": "별점은 왜 4.7에 몰리는가",
      "subtitle": "배달앱 리뷰 12만 건으로 본 평점 인플레이션의 원인",
      "cover": "assets/deck-covers/delivery-rating.webp",
      "slides": 3,
      "duration_sec": 139.8,
      "questions": 2,
      "recorded_at": "2026-10-11"
    },
    {
      "id": "battery-fastcharge",
      "label": "A-1",
      "title": "급속충전은 배터리를 얼마나 깎는가",
      "subtitle": "충전 속도와 온도에 따른 리튬이온 셀 용량 열화 비교",
      "cover": "assets/deck-covers/battery-fastcharge.webp",
      "slides": 4,
      "duration_sec": 155.3,
      "questions": 1,
      "recorded_at": "2026-10-11"
    },
    {
      "id": "microplastic-daphnia",
      "label": "B-1",
      "title": "미세플라스틱은 물벼룩의 번식을 줄이는가",
      "subtitle": "폴리스티렌 1 µm 입자 농도별 21일 만성 노출 실험",
      "cover": "assets/deck-covers/microplastic-daphnia.webp",
      "slides": 4,
      "duration_sec": 159.9,
      "questions": 3,
      "recorded_at": "2026-10-11"
    }
  ]
}
